{"artifact_status":"test-only","entry_set_digest":"sha256:6516f95586eee87c794b9862e3d7962b6598b1e19ee8a131e4f2ebc4c5bf5248","generated_at":"2026-08-03T00:00:00Z","key_statuses":[{"compromise_indicator":true,"effective_at":"2026-08-03T00:00:00Z","entry_type":"key-status","key_id":"sha256:06e3fd8fda29bb60ab59557de61edb0aecdb231134be30e75b455f8e1b792fa9","reason_code":"fixture-key-compromised","replacement_key_id":null,"status":"revoked","status_entry_digest":"sha256:bc4766bd2723fbbf0631f6d9f55ff131d5be588c1248a20878bf7c74c2f2a3bf","usage":"release-signing"}],"previous_status_set_digest":"sha256:dafdc1e6d987d754efc430b995d6706f7e98b89f2f537f1f70310108f7e458bd","record_type":"public-release-status-set","release_statuses":[{"bundle_manifest_digest":"sha256:c76653233aadae34f895349545d41b499a0e8f37474436642f2cafaf51473d4c","effective_at":"2026-08-03T00:00:00Z","entry_type":"release-status","notice_digest":null,"reason_code":"fixture-release-active","release_id":"private-match-assurance-fixture-release-0.1.0","replacement_bundle_digest":null,"replacement_release_id":null,"state":"active","status_entry_digest":"sha256:7a50162a5d30c47fed3a0172413421f9ad05de1766693867cb2a0640bef87586"}],"revision":2,"schema_version":"0.1","signing_key_id":"sha256:deb2ded39dc26fce0e6085b6fc34bf6b5941913bbfe2ea614113cff9e004c170","status_set_digest":"sha256:4e34c399e045dedea9e70686ab6f56b12f31ad4bea80b53645f9d78d301c3a7b","status_set_id":"PMA-PUBLIC-RELEASE-STATUS-FIXTURE-V0-1","trust_domain_id":"itdo-private-match-assurance-fixture-v0.1"}