{"artifact_status":"test-only","entry_set_digest":"sha256:f5c2ac3a09605aed0b62cd164fa9e23d7b77029ee42d836670c8206e99616ba2","generated_at":"2026-08-01T00:00:00Z","key_statuses":[{"compromise_indicator":false,"effective_at":"2026-08-01T00:00:00Z","entry_type":"key-status","key_id":"sha256:06e3fd8fda29bb60ab59557de61edb0aecdb231134be30e75b455f8e1b792fa9","reason_code":"fixture-key-active","replacement_key_id":null,"status":"active","status_entry_digest":"sha256:ffb90cebe3fe7d5f109acc9a35d1e813fbd2d14c1dbfb9cfe0111037975bf5df","usage":"release-signing"},{"compromise_indicator":false,"effective_at":"2026-08-01T00:00:00Z","entry_type":"key-status","key_id":"sha256:deb2ded39dc26fce0e6085b6fc34bf6b5941913bbfe2ea614113cff9e004c170","reason_code":"fixture-status-authority-active","replacement_key_id":null,"status":"active","status_entry_digest":"sha256:9154cda5cf37b1f7fbf3ea2c111933b16b46a7e4eca6df15b9da3e74b118f978","usage":"release-status-signing"}],"previous_status_set_digest":null,"record_type":"public-release-status-set","release_statuses":[{"bundle_manifest_digest":"sha256:10425d21d5186bc5a0ff9da7bdc816b9f8934d7b6ab0ecb8ccd09e6f58cb27ff","effective_at":"2026-08-01T00:00:00Z","entry_type":"release-status","notice_digest":null,"reason_code":"fixture-release-active","release_id":"private-match-assurance-fixture-release-0.1.0","replacement_bundle_digest":null,"replacement_release_id":null,"state":"active","status_entry_digest":"sha256:91f063c7a6f8f9eed3dc6499cc4de086a7f43c20a60ec8127da5d2a4fbdf9500"}],"revision":1,"schema_version":"0.1","signing_key_id":"sha256:deb2ded39dc26fce0e6085b6fc34bf6b5941913bbfe2ea614113cff9e004c170","status_set_digest":"sha256:f2d4cb7fe18d3bb2702ce1d3daf2f849da14a93c1f85b16b26f449304528b64c","status_set_id":"PMA-PUBLIC-RELEASE-STATUS-FIXTURE-V0-1","trust_domain_id":"itdo-private-match-assurance-fixture-v0.1"}