{"artifact_status":"test-only","entry_set_digest":"sha256:d9fb084d1a8eef8665219c27a8c869dbc9eba221bced495a6139bcd67a74b3cb","generated_at":"2026-08-03T00:00:00Z","key_statuses":[{"compromise_indicator":false,"effective_at":"2026-08-03T00:00:00Z","entry_type":"key-status","key_id":"sha256:06e3fd8fda29bb60ab59557de61edb0aecdb231134be30e75b455f8e1b792fa9","reason_code":"fixture-key-active","replacement_key_id":null,"status":"active","status_entry_digest":"sha256:4478c7c66d8558486a374e8f7aae5037c7e5bcb063f72f47dcd036d5f5d1cc67","usage":"release-signing"}],"previous_status_set_digest":"sha256:ad7b523b1d0d48b1579c2090677e4eb9018cb62e5c8c4b7e14e4777a2b83397a","record_type":"public-release-status-set","release_statuses":[{"bundle_manifest_digest":"sha256:5bfde7ba6b1901671d4a6a710ca120c4ff9567b2cd705670668072ba6b102205","effective_at":"2026-08-03T00:00:00Z","entry_type":"release-status","notice_digest":null,"reason_code":"fixture-release-corrected","release_id":"private-match-assurance-fixture-release-0.1.0","replacement_bundle_digest":"sha256:9a9a9a9a9a9a9a9a9a9a9a9a9a9a9a9a9a9a9a9a9a9a9a9a9a9a9a9a9a9a9a9a","replacement_release_id":"private-match-assurance-fixture-release-0.2.0","state":"corrected","status_entry_digest":"sha256:98cbad0d3b2226acbb0b832d7d740c63b3bddcecd7edb232bedbcd0cafb64cf3"}],"revision":2,"schema_version":"0.1","signing_key_id":"sha256:deb2ded39dc26fce0e6085b6fc34bf6b5941913bbfe2ea614113cff9e004c170","status_set_digest":"sha256:a2c8b63af67f6a8fceee4adbd9c2e7fa12a49ae0514931d729cd1b00b3b28b44","status_set_id":"PMA-PUBLIC-RELEASE-STATUS-FIXTURE-V0-1","trust_domain_id":"itdo-private-match-assurance-fixture-v0.1"}