{"artifact_status":"test-only","entry_set_digest":"sha256:8dd91bf6a7da41510c2941350fa269730c632c7fc6dd689df75fe70d2d8ecf8c","generated_at":"2026-08-03T00:00:00Z","key_statuses":[{"compromise_indicator":false,"effective_at":"2026-08-03T00:00:00Z","entry_type":"key-status","key_id":"sha256:06e3fd8fda29bb60ab59557de61edb0aecdb231134be30e75b455f8e1b792fa9","reason_code":"fixture-key-active","replacement_key_id":null,"status":"active","status_entry_digest":"sha256:4478c7c66d8558486a374e8f7aae5037c7e5bcb063f72f47dcd036d5f5d1cc67","usage":"release-signing"}],"previous_status_set_digest":"sha256:ed974aa8fcd901928740b0875807411e7218c131b8d4d1cca20e7dde3efe6074","record_type":"public-release-status-set","release_statuses":[{"bundle_manifest_digest":"sha256:7ecff1079afe60b8169bc420d25aa6ee3626dfc020631fe886c00b8b73181092","effective_at":"2026-08-03T00:00:00Z","entry_type":"release-status","notice_digest":null,"reason_code":"fixture-release-expired","release_id":"private-match-assurance-fixture-release-0.1.0","replacement_bundle_digest":null,"replacement_release_id":null,"state":"expired","status_entry_digest":"sha256:5541aeacf5f4b9ec993db71ae1ddb55d0b935eb06f60c120f1d82dbad5ba4a3c"}],"revision":2,"schema_version":"0.1","signing_key_id":"sha256:deb2ded39dc26fce0e6085b6fc34bf6b5941913bbfe2ea614113cff9e004c170","status_set_digest":"sha256:3e66c62f648cdde73823af07dfba8c85812c3473f3c07dc4e85e4824dbbac941","status_set_id":"PMA-PUBLIC-RELEASE-STATUS-FIXTURE-V0-1","trust_domain_id":"itdo-private-match-assurance-fixture-v0.1"}