{"artifact_status":"test-only","entry_set_digest":"sha256:988aef25671fbc1996a6f3c55990be6b306218d83df0a02788def32d492a8b69","generated_at":"2026-08-01T00:00:00Z","key_statuses":[{"compromise_indicator":false,"effective_at":"2026-08-01T00:00:00Z","entry_type":"key-status","key_id":"sha256:06e3fd8fda29bb60ab59557de61edb0aecdb231134be30e75b455f8e1b792fa9","reason_code":"fixture-key-active","replacement_key_id":null,"status":"active","status_entry_digest":"sha256:ffb90cebe3fe7d5f109acc9a35d1e813fbd2d14c1dbfb9cfe0111037975bf5df","usage":"release-signing"}],"previous_status_set_digest":null,"record_type":"public-release-status-set","release_statuses":[{"bundle_manifest_digest":"sha256:c76653233aadae34f895349545d41b499a0e8f37474436642f2cafaf51473d4c","effective_at":"2026-08-01T00:00:00Z","entry_type":"release-status","notice_digest":null,"reason_code":"fixture-release-active","release_id":"private-match-assurance-fixture-release-0.1.0","replacement_bundle_digest":null,"replacement_release_id":null,"state":"active","status_entry_digest":"sha256:732f8bff535d03f1fe93d0b44e5a10f4b7ddb5998a488f2986a4ff63aae47df4"}],"revision":1,"schema_version":"0.1","signing_key_id":"sha256:deb2ded39dc26fce0e6085b6fc34bf6b5941913bbfe2ea614113cff9e004c170","status_set_digest":"sha256:dafdc1e6d987d754efc430b995d6706f7e98b89f2f537f1f70310108f7e458bd","status_set_id":"PMA-PUBLIC-RELEASE-STATUS-FIXTURE-V0-1","trust_domain_id":"itdo-private-match-assurance-fixture-v0.1"}