{"artifact_status":"test-only","entry_set_digest":"sha256:87716323f00a5db23cb1be5914d1da39d671f75493e8cfc69970664cbb93d225","generated_at":"2026-08-03T00:00:00Z","key_statuses":[{"compromise_indicator":false,"effective_at":"2026-08-03T00:00:00Z","entry_type":"key-status","key_id":"sha256:06e3fd8fda29bb60ab59557de61edb0aecdb231134be30e75b455f8e1b792fa9","reason_code":"fixture-key-active","replacement_key_id":null,"status":"active","status_entry_digest":"sha256:4478c7c66d8558486a374e8f7aae5037c7e5bcb063f72f47dcd036d5f5d1cc67","usage":"release-signing"}],"previous_status_set_digest":"sha256:dafdc1e6d987d754efc430b995d6706f7e98b89f2f537f1f70310108f7e458bd","record_type":"public-release-status-set","release_statuses":[{"bundle_manifest_digest":"sha256:c76653233aadae34f895349545d41b499a0e8f37474436642f2cafaf51473d4c","effective_at":"2026-08-03T00:00:00Z","entry_type":"release-status","notice_digest":null,"reason_code":"fixture-release-superseded","release_id":"private-match-assurance-fixture-release-0.1.0","replacement_bundle_digest":"sha256:9a9a9a9a9a9a9a9a9a9a9a9a9a9a9a9a9a9a9a9a9a9a9a9a9a9a9a9a9a9a9a9a","replacement_release_id":"private-match-assurance-fixture-release-0.2.0","state":"superseded","status_entry_digest":"sha256:b4123280591d559619f7e3092ce1e337b2e08ce1f643721011a819a40056fa9c"}],"revision":2,"schema_version":"0.1","signing_key_id":"sha256:deb2ded39dc26fce0e6085b6fc34bf6b5941913bbfe2ea614113cff9e004c170","status_set_digest":"sha256:bcb0483d68a7ad975f77f158869d03a7b2dce8612a2db837897e801c0a89053c","status_set_id":"PMA-PUBLIC-RELEASE-STATUS-FIXTURE-V0-1","trust_domain_id":"itdo-private-match-assurance-fixture-v0.1"}