{"artifact_status":"test-only","entry_set_digest":"sha256:63107e34f0629e17b8f2daeb19d6c20801220f5249a46910a93d054a1b631906","generated_at":"2026-08-01T00:00:00Z","key_statuses":[{"compromise_indicator":false,"effective_at":"2026-08-01T00:00:00Z","entry_type":"key-status","key_id":"sha256:06e3fd8fda29bb60ab59557de61edb0aecdb231134be30e75b455f8e1b792fa9","reason_code":"fixture-key-active","replacement_key_id":null,"status":"active","status_entry_digest":"sha256:ffb90cebe3fe7d5f109acc9a35d1e813fbd2d14c1dbfb9cfe0111037975bf5df","usage":"release-signing"}],"previous_status_set_digest":null,"record_type":"public-release-status-set","release_statuses":[{"bundle_manifest_digest":"sha256:5bfde7ba6b1901671d4a6a710ca120c4ff9567b2cd705670668072ba6b102205","effective_at":"2026-08-01T00:00:00Z","entry_type":"release-status","notice_digest":null,"reason_code":"fixture-release-active","release_id":"private-match-assurance-fixture-release-0.1.0","replacement_bundle_digest":null,"replacement_release_id":null,"state":"active","status_entry_digest":"sha256:dce876f486730d66366dc734be3f4752bf783cf684364c661b0a9460fbf67ef4"}],"revision":1,"schema_version":"0.1","signing_key_id":"sha256:deb2ded39dc26fce0e6085b6fc34bf6b5941913bbfe2ea614113cff9e004c170","status_set_digest":"sha256:ad7b523b1d0d48b1579c2090677e4eb9018cb62e5c8c4b7e14e4777a2b83397a","status_set_id":"PMA-PUBLIC-RELEASE-STATUS-FIXTURE-V0-1","trust_domain_id":"itdo-private-match-assurance-fixture-v0.1"}